contexte_gauche	motif_trouve	contexte_droit
job requirements, and any other general 	cyber	"security career questions? Ask away!

In"
easily searchable for the future. Hey r/	cyber	"security,

I'm currently at the start of"
currently at the start of a master's in 	Cyber	security after finishing a bachelor's in
"200, TCM PSAA).

**TL;DR**: Master's in "	Cyber	security is giving me theory but no prac
prove our deals / contracts for several 	cyber	 security solutions I’m managing. Is the
ffective strategy to get a good deal on 	cyber	" security solutions? 

Anyone any experi"
would be one of two responsible for the 	Cyber	security. Their plan is that the have an
. As my old job doesn't really care for 	Cyber	security the responsibilities weren't de
"let me know  
[https://www.reddit.com/r/"	cyber	security/comments/1pgmvtk/how\_almost\_a
tracked\_via/](https://www.reddit.com/r/	cyber	security/comments/1pgmvtk/how_almost_any
offline) I want to start learning about 	cyber	security and eventually get into bug bou
 I want to learn the networking part of 	cyber	"security and ethical hacking.

  
 Anyon"
educational I am writing a paper for my 	Cyber	 Security class.  It always boggles my m
 my mind how hacking is still possible. 	Cyber	 security primitives are so strong and c
increasingly exposed to a wide range of 	cyber	-physical threats. Efficient models and 
complex structure and identify critical 	cyber	-physical components are therefore essen
, ICS settings normally involve various 	cyber	 and physical security measures that sim
ealistic Water Transport Network (WTN). 	Cyber	 ranges mimic real-world cyber environme
rk (WTN). Cyber ranges mimic real-world 	cyber	 environments and are in high demand. Be
 high demand. Before building their own 	cyber	 ranges, organizations need to deeply un
le to them. A fundamental supply is the 	cyber	 range architecture, which prompts an im
s an important research question: Which 	cyber	 range architecture is most appropriate 
pose an innovative framework to specify 	cyber	 range requirements, characterize cyber 
 cyber range requirements, characterize 	cyber	 range architectures (based on our analy
hitectures (based on our analysis of 45 	cyber	 range architectures), and match cyber r
5 cyber range architectures), and match 	cyber	 range architectures to cyber range requ
 and match cyber range architectures to 	cyber	 range requirements. Cyber-physical syst
hitectures to cyber range requirements. 	Cyber	-physical systems are at the intersectio
argets of sophisticated and well-funded 	cyber	security threat actors. Prominent cybers
 cybersecurity threat actors. Prominent 	cyber	security attacks on CPS have brought att
 today, and how they address real-world 	cyber	security threats and CPS-specific attack
lti-agent characteristics of real-world 	cyber	-physical attacks. Quantum computing is 
ions. It has major implications for the 	cyber	 security industry. Existing cyber prote
r the cyber security industry. Existing 	cyber	 protection applications are working wel
 research questions asking what kind of 	cyber	 protection applications of quantum comp
l methods or techniques can be used for 	cyber	 protection? These questions will reveal
quantum technologies are implemented in 	cyber	 environments. This scoping review discu
rous quantum computing applications for 	cyber	 protection and a number of techniques t
ecurity of quantum computing in various 	cyber	 security domains. Additionally, it enco
d methods can be deployed to secure the 	cyber	 world. The fields of study encompassed 
rld. The fields of study encompassed by 	cyber	 science and engineering are broad and p
 disruptive changes that might occur in 	cyber	 security within the next 15 years. We s
ffer recommendations for advancement of 	cyber	 science and engineering with respect to
s on handling IoT-empowered malware for 	cyber	 security. Comparing with the malware pr
e describe the design and assembly of a 	cyber	 security testbed at Oak Ridge National 
riety of experiments for evaluations of 	cyber	 security tools -- particularly those in
nce and operating costs for AI/ML-based 	cyber	 security tools for application into lar
sses are tightly intertwined with their 	cyber	 counterparts. This led to an emergence 
ital twin will be the key technology in 	Cyber	-Physical Production Systems (CPPS) and 
CS) have become an appealing target for 	cyber	 attacks, having massive destructive con
c based on AND/OR graphs that represent 	cyber	-physical dependencies among network com
o efficiently identify sets of critical 	cyber	-physical components, with minimal cost 
-all networking solution for developing 	cyber	-physical systems. Network slicing is a 
d to meet the requirements of different 	cyber	-physical systems. However, it is challe
e end-to-end network slices for diverse 	cyber	-physical systems. In this article, we d
alating frequency and sophistication of 	cyber	 threats increased the need for their co
 intersection of geopolitical dynamics, 	cyber	 threat intelligence analysis, and advan
ract and structure information from raw 	cyber	 threat descriptions, enabling enhanced 
nally, we evaluate the effectiveness of 	cyber	security tools -- with particular emphas
tion to researchers, policy makers, and 	cyber	security professionals. This paper provi
des an overview of research programs in 	cyber	 security performed by the U.S Army Rese
y-oriented programs. One example is the 	Cyber	 Collaborative Research Alliance (CRA) t
s from dozens of U.S. universities. ARL 	cyber	 scientists are largely driven by challe
arch efforts. The long-term campaign of 	cyber	 research is guided by the vision of the
converged virtual-physical space, where 	cyber	 operations will be an integral part of 
art of the battle. The threats faced by 	cyber	-physical systems (CPSs) in critical inf
logies has also caught the attention of 	cyber	criminals. For example, a cyberattack on
ntion of cybercriminals. For example, a 	cyber	attack on one shipping company resulted 
ial losses. Hence, this paper describes 	cyber	security vulnerabilities present in the 
is the identification and dissection of 	cyber	 vulnerabilities specific to the shippin
dent management is a classical topic in 	cyber	 security. Recently, the European Union 
d to consider also the relation between 	cyber	 security incidents and cyber security c
on between cyber security incidents and 	cyber	 security crises. These considerations a
cluding those specified in the EU's new 	cyber	 security laws, constitute the paper's t
ws and associated policy documents, (i) 	cyber	 security crises are equated in the EU t
es are equated in the EU to large-scale 	cyber	 security incidents that either exceed a
ally increase mandatory reporting about 	cyber	 security incidents, including but not l
m, however, (iii) the working of actual 	cyber	 security crisis management remains uncl
sults, the paper advances the domain of 	cyber	 security incident management research b
 elaborating how European law perceives 	cyber	 security crises and their relation to c
r security crises and their relation to 	cyber	 security incidents, paving the way for 
l, conceptual, or empirical. Autonomous 	Cyber	 Defence is required to respond to high-
ce is required to respond to high-tempo 	cyber	-attacks. To facilitate the research in 
e explore the utility of the autonomous 	cyber	 operation environments presented as par
n environments presented as part of the 	Cyber	 Autonomy Gym for Experimentation (CAGE)
e most capable of learning an effective 	cyber	 defensive strategy. Our analysis of the
are a suitable candidate for autonomous 	cyber	 defence applications. Large Language Mo
navailable in other domains, especially 	cyber	security, where challenge configurations
are ephemeral or restricted. We present 	Cyber	-Zero, the first runtime-free framework 
igh-quality agent trajectories to train 	cyber	security LLMs. Cyber-Zero leverages publ
ajectories to train cybersecurity LLMs. 	Cyber	-Zero leverages publicly available CTF w
ents. Using trajectories synthesized by 	Cyber	-Zero, we train LLM-based agents that ac
CTF Bench, and Cybench. Our best model, 	Cyber	-Zero-32B, establishes new state-of-the-
ize the development of state-of-the-art 	cyber	security agents. Current research on use
rent research on users` perspectives of 	cyber	 security and privacy related to traditi
dataset to understand non-expert users` 	cyber	 security and privacy perspectives, incl
increase in non-expert users` tweets on 	cyber	 security and/or privacy related topics 
re of non-expert users` perspectives on 	cyber	 security and privacy and call for more 
Given the rapid evolution of threats to 	cyber	 systems, new management approaches are 
 information, cognitive, and social) of 	cyber	 systems. Further, the traditional appro
he traditional approach of hardening of 	cyber	 systems against identified threats has 
fections and other attacks, so too must 	cyber	 systems adapt to ever-changing threats 
d properties, and make business case of 	cyber	 resilience. We also offer a brief summa
offer a brief summary of ways to assess 	cyber	 resilience of a system, and approaches 
f a system, and approaches to improving 	cyber	 resilience. The present paper focuses o
esilience. The present paper focuses on 	Cyber	 Security Awareness Campaigns, and aims 
