id	titre	auteur	date	url	texte	type	coauthors
19	Towards Systematically Deriving Defence Mechanisms from Functional Requirements of Cyber-Physical Systems	Cheah Huei Yoong	2020-07-07T17:40:13+00:00	https://arxiv.org/abs/2007.03651v2	The threats faced by cyber-physical systems (CPSs) in critical infrastructure have motivated the development of different attack detection mechanisms, such as those that monitor for violations of invariants, i.e. properties that always hold in normal operation. Given the complexity of CPSs, several existing approaches focus on deriving invariants automatically from data logs, but these can miss possible system behaviours if they are not represented in that data. Furthermore, resolving any design flaws identified in this process is costly, as the CPS is already built. In this position paper, we propose a systematic method for deriving invariants before a CPS is built by analysing its functional requirements. Our method, inspired by the axiomatic design methodology for systems, iteratively analyses dependencies in the design to construct equations and process graphs that model the invariant relationships between CPS components. As a preliminary study, we applied it to the design of a water treatment plant testbed, implementing checkers for two invariants by using decision trees, and finding that they could detect some examples of attacks on the testbed with high accuracy and without false positives. Finally, we explore how developing our method further could lead to more robust CPSs and reduced costs by identifying design weaknesses before systems are implemented.	arxiv	Venkata Reddy Palleti, Arlindo Silva, Christopher M. Poskitt
20	Cyber Pirates Ahoy! An Analysis of Cybersecurity Challenges in the Shipping Industry	George Grispos	2022-08-07T00:49:36+00:00	https://arxiv.org/abs/2208.03607v1	Maritime shipping has become a trillion-dollar industry that now impacts the economy of virtually every country around the world. It is therefore no surprise that countries and companies have spent billions of dollars to modernize shipping vessels and ports with various technologies. However, the implementation of these technologies has also caught the attention of cybercriminals. For example, a cyberattack on one shipping company resulted in nearly $300 millions in financial losses. Hence, this paper describes cybersecurity vulnerabilities present in the international shipping business. The contribution of this paper is the identification and dissection of cyber vulnerabilities specific to the shipping industry, along with how and why these potential vulnerabilities exist.	arxiv	William R. Mahoney
21	From Cyber Security Incident Management to Cyber Security Crisis Management in the European Union	Jukka Ruohonen	2025-04-19T08:03:29+00:00	https://arxiv.org/abs/2504.14220v2	Incident management is a classical topic in cyber security. Recently, the European Union (EU) has started to consider also the relation between cyber security incidents and cyber security crises. These considerations and preparations, including those specified in the EU's new cyber security laws, constitute the paper's topic. According to an analysis of the laws and associated policy documents, (i) cyber security crises are equated in the EU to large-scale cyber security incidents that either exceed a handling capacity of a single member state or affect at least two member states. For this and other purposes, (ii) the new laws substantially increase mandatory reporting about cyber security incidents, including but not limited to the large-scale incidents. Despite the laws and new governance bodies established by them, however, (iii) the working of actual cyber security crisis management remains unclear particularly at the EU-level. With these policy research results, the paper advances the domain of cyber security incident management research by elaborating how European law perceives cyber security crises and their relation to cyber security incidents, paving the way for many relevant further research topics with practical relevance, whether theoretical, conceptual, or empirical.	arxiv	Kalle Rindell, Simone Busetti
22	On Autonomous Agents in a Cyber Defence Environment	Mitchell Kiely	2023-09-14T02:09:36+00:00	https://arxiv.org/abs/2309.07388v1	Autonomous Cyber Defence is required to respond to high-tempo cyber-attacks. To facilitate the research in this challenging area, we explore the utility of the autonomous cyber operation environments presented as part of the Cyber Autonomy Gym for Experimentation (CAGE) Challenges, with a specific focus on CAGE Challenge 2. CAGE Challenge 2 required a defensive Blue agent to defend a network from an attacking Red agent. We provide a detailed description of the this challenge and describe the approaches taken by challenge participants. From the submitted agents, we identify four classes of algorithms, namely, Single- Agent Deep Reinforcement Learning (DRL), Hierarchical DRL, Ensembles, and Non-DRL approaches. Of these classes, we found that the hierarchical DRL approach was the most capable of learning an effective cyber defensive strategy. Our analysis of the agent policies identified that different algorithms within the same class produced diverse strategies and that the strategy used by the defensive Blue agent varied depending on the strategy used by the offensive Red agent. We conclude that DRL algorithms are a suitable candidate for autonomous cyber defence applications.	arxiv	David Bowman, Maxwell Standen, Christopher Moir
23	Cyber-Zero: Training Cybersecurity Agents without Runtime	Terry Yue Zhuo	2025-07-29T18:10:37+00:00	https://arxiv.org/abs/2508.00910v2	Large Language Models (LLMs) have achieved remarkable success in software engineering tasks when trained with executable runtime environments, particularly in resolving GitHub issues. However, such runtime environments are often unavailable in other domains, especially cybersecurity, where challenge configurations and execution contexts are ephemeral or restricted. We present Cyber-Zero, the first runtime-free framework for synthesizing high-quality agent trajectories to train cybersecurity LLMs. Cyber-Zero leverages publicly available CTF writeups and employs persona-driven LLM simulation to reverse-engineer runtime behaviors and generate realistic, long-horizon interaction sequences without actual environments. Using trajectories synthesized by Cyber-Zero, we train LLM-based agents that achieve up to 13.1% absolute performance gains over baseline models on three prominent CTF benchmarks: InterCode-CTF, NYU CTF Bench, and Cybench. Our best model, Cyber-Zero-32B, establishes new state-of-the-art performance among open-weight models, matching the capabilities of proprietary systems like DeepSeek-V3-0324 and Claude-3.5-Sonnet while offering superior cost-effectiveness, and demonstrating that runtime-free trajectory synthesis can effectively democratize the development of state-of-the-art cybersecurity agents.	arxiv	Dingmin Wang, Hantian Ding, Varun Kumar, Zijian Wang
24	Perspectives of Non-Expert Users on Cyber Security and Privacy: An Analysis of Online Discussions on Twitter	Nandita Pattnaik	2022-06-05T11:54:48+00:00	https://arxiv.org/abs/2206.02156v2	Current research on users` perspectives of cyber security and privacy related to traditional and smart devices at home is very active, but the focus is often more on specific modern devices such as mobile and smart IoT devices in a home context. In addition, most were based on smaller-scale empirical studies such as online surveys and interviews. We endeavour to fill these research gaps by conducting a larger-scale study based on a real-world dataset of 413,985 tweets posted by non-expert users on Twitter in six months of three consecutive years (January and February in 2019, 2020 and 2021). Two machine learning-based classifiers were developed to identify the 413,985 tweets. We analysed this dataset to understand non-expert users` cyber security and privacy perspectives, including the yearly trend and the impact of the COVID-19 pandemic. We applied topic modelling, sentiment analysis and qualitative analysis of selected tweets in the dataset, leading to various interesting findings. For instance, we observed a 54% increase in non-expert users` tweets on cyber security and/or privacy related topics in 2021, compared to before the start of global COVID-19 lockdowns (January 2019 to February 2020). We also observed an increased level of help-seeking tweets during the COVID-19 pandemic. Our analysis revealed a diverse range of topics discussed by non-expert users across the three years, including VPNs, Wi-Fi, smartphones, laptops, smart home devices, financial security, and security and privacy issues involving different stakeholders. Overall negative sentiment was observed across almost all topics non-expert users discussed on Twitter in all the three years. Our results confirm the multi-faceted nature of non-expert users` perspectives on cyber security and privacy and call for more holistic, comprehensive and nuanced research on different facets of such perspectives.	arxiv	Shujun Li, Jason R. C. Nurse
25	Fundamental Concepts of Cyber Resilience: Introduction and Overview	Igor Linkov	2018-06-07T18:21:07+00:00	https://arxiv.org/abs/1806.02852v1	Given the rapid evolution of threats to cyber systems, new management approaches are needed that address risk across all interdependent domains (i.e., physical, information, cognitive, and social) of cyber systems. Further, the traditional approach of hardening of cyber systems against identified threats has proven to be impossible. Therefore, in the same way that biological systems develop immunity as a way to respond to infections and other attacks, so too must cyber systems adapt to ever-changing threats that continue to attack vital system functions, and to bounce back from the effects of the attacks. Here, we explain the basic concepts of resilience in the context of systems, discuss related properties, and make business case of cyber resilience. We also offer a brief summary of ways to assess cyber resilience of a system, and approaches to improving cyber resilience.	arxiv	Alexander Kott
26	Cyber Security Awareness Campaigns: Why do they fail to change behaviour?	Maria Bada	2019-01-09T10:45:57+00:00	https://arxiv.org/abs/1901.02672v1	The present paper focuses on Cyber Security Awareness Campaigns, and aims to identify key factors regarding security which may lead them to failing to appropriately change people's behaviour. Past and current efforts to improve information-security practices and promote a sustainable society have not had the desired impact. It is important therefore to critically reflect on the challenges involved in improving information-security behaviours for citizens, consumers and employees. In particular, our work considers these challenges from a Psychology perspective, as we believe that understanding how people perceive risks is critical to creating effective awareness campaigns. Changing behaviour requires more than providing information about risks and reactive behaviours - firstly, people must be able to understand and apply the advice, and secondly, they must be motivated and willing to do so - and the latter requires changes to attitudes and intentions. These antecedents of behaviour change are identified in several psychological models of behaviour. We review the suitability of persuasion techniques, including the widely used 'fear appeals'. From this range of literature, we extract essential components for an awareness campaign as well as factors which can lead to a campaign's success or failure. Finally, we present examples of existing awareness campaigns in different cultures (the UK and Africa) and reflect on these.	arxiv	Angela M. Sasse, Jason R. C. Nurse
