id	titre	auteur	date	url	texte	type	coauthors
1	I run a Red Team that routinely succeeds in compromising F500 companies. AMA.	curi0usJack	2025-11-24T16:01:39	https://www.reddit.com/r/cybersecurity/comments/1p5jah5/i_run_a_red_team_that_routinely_succeeds_in/	"My name is Jason, and I run the Targeted Operations Red Team at TrustedSec - an end-to-end offensive security shop founded by David Kennedy and based in the Cleveland, OH area. We run all manner of advanced offensive security engagements and have succeeded in compromising some of the largest companies in the world. We work to improve defense teams and routinely present at conferences and board meetings alike.

I'm joined by several Targeted Operations operators:

u/oddvarmoe

u/int128

u/bebo_126

No question is off the table, but if you ask a troll question you are liable to get a troll answer (or no answer). xD

[www.trustedsec.com](http://www.trustedsec.com)

EDIT1: For newcomers wanting to get more into red team, offsec: [https://www.reddit.com/r/cybersecurity/comments/1p5jah5/comment/nqjqpnc/?utm\_source=share&utm\_medium=web3x&utm\_name=web3xcss&utm\_term=1&utm\_content=share\_button](https://www.reddit.com/r/cybersecurity/comments/1p5jah5/comment/nqjqpnc/?utm_source=share&utm_medium=web3x&utm_name=web3xcss&utm_term=1&utm_content=share_button)

Also: [https://trustedsec.com/blog/a-career-in-it-where-do-i-start](https://trustedsec.com/blog/a-career-in-it-where-do-i-start)

EDIT2: For those wanting to get into physical: [https://www.reddit.com/r/cybersecurity/comments/1p5jah5/comment/nqjlmnb/?utm\_source=share&utm\_medium=web3x&utm\_name=web3xcss&utm\_term=1&utm\_content=share\_button](https://www.reddit.com/r/cybersecurity/comments/1p5jah5/comment/nqjlmnb/?utm_source=share&utm_medium=web3x&utm_name=web3xcss&utm_term=1&utm_content=share_button)

EDIT3: My favorite question so far: [https://www.reddit.com/r/cybersecurity/comments/1p5jah5/comment/nqk1d2c/?utm\_source=share&utm\_medium=web3x&utm\_name=web3xcss&utm\_term=1&utm\_content=share\_button](https://www.reddit.com/r/cybersecurity/comments/1p5jah5/comment/nqk1d2c/?utm_source=share&utm_medium=web3x&utm_name=web3xcss&utm_term=1&utm_content=share_button)

EDIT4: On imposter syndrome: [https://www.reddit.com/r/cybersecurity/comments/1p5jah5/comment/nqkq6a5/?utm\_source=share&utm\_medium=web3x&utm\_name=web3xcss&utm\_term=1&utm\_content=share\_button](https://www.reddit.com/r/cybersecurity/comments/1p5jah5/comment/nqkq6a5/?utm_source=share&utm_medium=web3x&utm_name=web3xcss&utm_term=1&utm_content=share_button)"	reddit	
2	Mentorship Monday - Post All Career, Education and Job questions here!	AutoModerator	2025-11-24T01:00:34	https://www.reddit.com/r/cybersecurity/comments/1p523b6/mentorship_monday_post_all_career_education_and/	"This is the weekly thread for career and education questions and advice. There are no stupid questions; so, what do *you* want to know about certs/degrees, job requirements, and any other general cybersecurity career questions? Ask away!

Interested in what other people are asking, or think your question has been asked before? Have a look through prior weeks of content - though we're working on making this more easily searchable for the future."	reddit	
3	What’s the simplest way to prove a document hasn’t been modified?	Candid_Cut_7284	2025-11-27T12:53:22	https://www.reddit.com/r/cybersecurity/comments/1p80dkp/whats_the_simplest_way_to_prove_a_document_hasnt/	"I’m curious how people in cybersecurity think about this from a practical angle.

I don’t mean blockchain, audit logs, or heavy enterprise systems, I mean something normal humans could actually use lol. Clients, lawyers, freelancers, small teams… anyone who just wants a simple way to show “here’s the file, here’s proof it wasn’t altered.”

Is there a straightforward, privacy-respecting method for this that doesn’t require a big infrastructure setup?  
  
Or is the future basically: “everyone needs to learn integrity verification whether they like it or not”?

Not looking for product recommendations, more interested in the *concepts* or approaches professionals actually trust."	reddit	
4	Does self-learning (without using it at work) actually help your CV or career profile ?	Majestic_Can7328	2025-11-27T11:56:09	https://www.reddit.com/r/cybersecurity/comments/1p7zeny/does_selflearning_without_using_it_at_work/	"I’m currently looking for a new job in cybersecurity, but I’m a bit tired of constantly learning new work environment/politic challenges at work. I’m considering applying for a role that is easier and doesn’t require me to learn many new things on the job. (Pay is also good but reduce from previous one as i will have more time)

However, I’m wondering:

* Is it okay to choose a job like that, or will it hurt my career later?
* Can I just learn new security technologies on my own instead of at work?
* Does self-learning (without using it at work) actually help your CV or career profile?

I’d love some advice from people in the field. Thanks!"	reddit	
5	its tough..z	Nuttttella	2025-11-26T17:50:30	https://www.reddit.com/r/cybersecurity/comments/1p7crv9/its_toughz/	"•I will graduate in May of 2026 with a B.S in Computer Information Systems and Technology, with a concentration in Cybersecurity Management.

•I have ~2 years of experience working at a Help Desk Supervisor.

•Currently a Vulnerability Management Intern at a Fortune 100 company, started in June.

I was edged by my manager thats ill be able to convert to full time when I graduate, but due to recent org changes theres no headcount on my team, however there might be a position on another team, and my HR manager is working to get me a spot but nothing is confirmed.

Because of this I have started applying to entry level positions. Its been slow, waiting for Feb-March wave again to hopefully get more interview, only had 1 so far (waiting for second round).

Any advice yall have for me to prepare for next wave cycle? Im alrdy preparing for sec+ and network+, and will get a splunk cert aswell. Looking for SOC, analyst, vuln management roles.

Edit: Thanks for the positivity and feedback! Things im gonna do: reach out to IR/ SOC team at my company, and see if I can shadow / learn anything from them.

Maybe instead of net + and sec+, just start doing SOC type project or labs? What are taps thoughts on this? 
"	reddit	
6	Is OBS plug multi stream rtmp safe ?	Top_Picture_9220	2025-11-24T16:44:40	https://www.reddit.com/r/hacking/comments/1p5ke4w/is_obs_plug_multi_stream_rtmp_safe/	"So I'm helping a friend out with her multi stream setup and she wanted to multi stream on YouTube Facebook and kick. So we found this plugin through YouTube and found this. Now we went to the GitHub link and downloaded it. Malwarebyte instantly blocked it and gave a notification of ""trojan dropper"" she got spoked by this as she spent a lot of money on this pc and doesn't want to risk getting the pc infected. 

It's the exe file from the October version.

Link to the github:https://github.com/sorayuki/obs-multi-rtmp/releases/"	reddit	
7	Assessing Cyber-Physical Security in Industrial Control Systems	Martín Barrère	2019-11-21T11:02:48+00:00	https://arxiv.org/abs/1911.09404v1	Over the last years, Industrial Control Systems (ICS) have become increasingly exposed to a wide range of cyber-physical threats. Efficient models and techniques able to capture their complex structure and identify critical cyber-physical components are therefore essential. AND/OR graphs have proven very useful in this context as they are able to semantically grasp intricate logical interdependencies among ICS components. However, identifying critical nodes in AND/OR graphs is an NP-complete problem. In addition, ICS settings normally involve various cyber and physical security measures that simultaneously protect multiple ICS components in overlapping manners, which makes this problem even harder. In this paper, we present an extended security metric based on AND/OR hypergraphs which efficiently identifies the set of critical ICS components and security measures that should be compromised, with minimum cost (effort) for an attacker, in order to disrupt the operation of vital ICS assets. Our approach relies on MAX-SAT techniques, which we have incorporated in META4ICS, a Java-based security metric analyser for ICS. We also provide a thorough performance evaluation that shows the feasibility of our method. Finally, we illustrate our methodology through a case study in which we analyse the security posture of a realistic Water Transport Network (WTN).	arxiv	Chris Hankin, Demetrios G. Eliades, Nicolas Nicolau, Thomas Parisini
8	Towards Automated Cyber Range Design: Characterizing and Matching Demands to Supplies	Ekzhin Ear	2023-07-10T08:44:01+00:00	https://arxiv.org/abs/2307.04416v1	Cyber ranges mimic real-world cyber environments and are in high demand. Before building their own cyber ranges, organizations need to deeply understand what construction supplies are available to them. A fundamental supply is the cyber range architecture, which prompts an important research question: Which cyber range architecture is most appropriate for an organization's requirements? To answer this question, we propose an innovative framework to specify cyber range requirements, characterize cyber range architectures (based on our analysis of 45 cyber range architectures), and match cyber range architectures to cyber range requirements.	arxiv	Jose L. C. Remy, Shouhuai Xu
9	Security Modelling for Cyber-Physical Systems: A Systematic Literature Review	Shaofei Huang	2024-04-11T07:41:36+00:00	https://arxiv.org/abs/2404.07527v3	Cyber-physical systems are at the intersection of digital technology and engineering domains, rendering them high-value targets of sophisticated and well-funded cybersecurity threat actors. Prominent cybersecurity attacks on CPS have brought attention to the vulnerability of these systems and the inherent weaknesses of critical infrastructure reliant on them. Security modelling for CPS is an important mechanism to systematically identify and assess vulnerabilities, threats, and risks throughout system life cycles, and to ultimately ensure system resilience, safety, and reliability. This survey delves into state-of-the-art research on CPS security modelling, encompassing both threat and attack modelling. While these terms are sometimes used interchangeably, they are different concepts. This paper elaborates on the differences between threat and attack modelling, examining their implications for CPS security. We conducted a systematic search that yielded 449 papers, from which 32 were selected and categorised into three clusters: those focused on threat modelling methods, attack modelling methods, and literature reviews. Specifically, we sought to examine what security modelling methods exist today, and how they address real-world cybersecurity threats and CPS-specific attacker capabilities throughout the life cycle of CPS, which typically span longer durations compared to traditional IT systems. This paper also highlights several limitations in existing research, wherein security models adopt simplistic approaches that do not adequately consider the dynamic, multi-layer, multi-path, and multi-agent characteristics of real-world cyber-physical attacks.	arxiv	Christopher M. Poskitt, Lwin Khin Shar
10	Cyber Protection Applications of Quantum Computing: A Review	Ummar Ahmed	2024-06-19T06:46:31+00:00	https://arxiv.org/abs/2406.13259v3	Quantum computing is a cutting-edge field of information technology that harnesses the principles of quantum mechanics to perform computations. It has major implications for the cyber security industry. Existing cyber protection applications are working well, but there are still challenges and vulnerabilities in computer networks. Sometimes data and privacy are also compromised. These complications lead to research questions asking what kind of cyber protection applications of quantum computing are there and what potential methods or techniques can be used for cyber protection? These questions will reveal how much power quantum computing has and to what extent it can outperform the conventional computing systems. This scoping review was conducted by considering 815 papers. It showed the possibilities that can be achievedif quantum technologies are implemented in cyber environments. This scoping review discusses various domains such as algorithms and applications, bioinformatics, cloud and edge computing, the organization of complex systems, application areas focused on security and threats, and the broader quantum computing ecosystem. In each of these areas, there is significant scope for quantum computing to be implemented and to revolutionize the working environment. Numerous quantum computing applications for cyber protection and a number of techniques to protect our data and privacy were identified. The results are not limited to network security but also include data security. This paper also discusses societal aspects, e.g., the applications of quantum computing in the social sciences. This scoping review discusses how to enhance the efficiency and security of quantum computing in various cyber security domains. Additionally, it encourages the reader to think about what kind of techniques and methods can be deployed to secure the cyber world.	arxiv	Tuomo Sipola, Jari Hautamäki
11	Six Potential Game-Changers in Cyber Security: Towards Priorities in Cyber Science and Engineering	Alexander Kott	2015-11-02T14:13:24+00:00	https://arxiv.org/abs/1511.00509v1	The fields of study encompassed by cyber science and engineering are broad and poorly defined at this time. As national governments and research communities increase their recognition of the importance, urgency and technical richness of these disciplines, a question of priorities arises: what specific sub-areas of research should be the foci of attention and funding? In this paper we point to an approach to answering this question. We explore results of a recent workshop that postulated possible game-changers or disruptive changes that might occur in cyber security within the next 15 years. We suggest that such game-changers may be useful in focusing attention of research communities on high-priority topics. Indeed, if a drastic, important change is likely to occur, should we not focus our research efforts on the nature and ramifications of the phenomena pertaining to that change? We illustrate each of the game-changers examples of related current research, and then offer recommendations for advancement of cyber science and engineering with respect to each of the six game-changers.	arxiv	Ananthram Swami, Patrick McDaniel
12	Traffic-aware Patching for Cyber Security in Mobile IoT	Shin-Ming Cheng	2017-03-15T21:59:05+00:00	https://arxiv.org/abs/1703.05400v1	The various types of communication technologies and mobility features in Internet of Things (IoT) on the one hand enable fruitful and attractive applications, but on the other hand facilitates malware propagation, thereby raising new challenges on handling IoT-empowered malware for cyber security. Comparing with the malware propagation control scheme in traditional wireless networks where nodes can be directly repaired and secured, in IoT, compromised end devices are difficult to be patched. Alternatively, blocking malware via patching intermediate nodes turns out to be a more feasible and practical solution. Specifically, patching intermediate nodes can effectively prevent the proliferation of malware propagation by securing infrastructure links and limiting malware propagation to local device-to-device dissemination. This article proposes a novel traffic-aware patching scheme to select important intermediate nodes to patch, which applies to the IoT system with limited patching resources and response time constraint. Experiments on real-world trace datasets in IoT networks are conducted to demonstrate the advantage of the proposed traffic-aware patching scheme in alleviating malware propagation.	arxiv	Pin-Yu Chen, Ching-Chao Lin, Hsu-Chun Hsiao
13	Assembling a Cyber Range to Evaluate Artificial Intelligence / Machine Learning (AI/ML) Security Tools	Jeffrey A. Nichols	2022-01-20T22:13:34+00:00	https://arxiv.org/abs/2201.08473v1	In this case study, we describe the design and assembly of a cyber security testbed at Oak Ridge National Laboratory in Oak Ridge, TN, USA. The range is designed to provide agile reconfigurations to facilitate a wide variety of experiments for evaluations of cyber security tools -- particularly those involving AI/ML. In particular, the testbed provides realistic test environments while permitting control and programmatic observations/data collection during the experiments. We have designed in the ability to repeat the evaluations, so additional tools can be evaluated and compared at a later time. The system is one that can be scaled up or down for experiment sizes. At the time of the conference we will have completed two full-scale, national, government challenges on this range. These challenges are evaluating the performance and operating costs for AI/ML-based cyber security tools for application into large, government-sized networks. These evaluations will be described as examples providing motivation and context for various design decisions and adaptations we have made. The first challenge measured end-point security tools against 100K file samples (benignware and malware) chosen across a range of file types. The second is an evaluation of network intrusion detection systems efficacy in identifying multi-step adversarial campaigns -- involving reconnaissance, penetration and exploitations, lateral movement, etc. -- with varying levels of covertness in a high-volume business network. The scale of each of these challenges requires automation systems to repeat, or simultaneously mirror identical the experiments for each ML tool under test. Providing an array of easy-to-difficult malicious activity for sussing out the true abilities of the AI/ML tools has been a particularly interesting and challenging aspect of designing and executing these challenge events.	arxiv	Kevin D. Spakes, Cory L. Watson, Robert A. Bridges
14	Challenges in Digital Twin Development for Cyber-Physical Production Systems	Heejong Park	2021-02-04T02:09:02+00:00	https://arxiv.org/abs/2102.03341v1	The recent advancement of information and communication technology makes digitalisation of an entire manufacturing shop-floor possible where physical processes are tightly intertwined with their cyber counterparts. This led to an emergence of a concept of digital twin, which is a realistic virtual copy of a physical object. Digital twin will be the key technology in Cyber-Physical Production Systems (CPPS) and its market is expected to grow significantly in the coming years. Nevertheless, digital twin is still relatively a new concept that people have different perspectives on its requirements, capabilities, and limitations. To better understand an effect of digital twin's operations, mitigate complexity of capturing dynamics of physical phenomena, and improve analysis and predictability, it is important to have a development tool with a strong semantic foundation that can accurately model, simulate, and synthesise the digital twin. This paper reviews current state-of-art on tools and developments of digital twin in manufacturing and discusses potential design challenges.	arxiv	Arvind Easwaran, Sidharta Andalam
15	Identifying Security-Critical Cyber-Physical Components in Industrial Control Systems	Martín Barrère	2019-05-12T21:53:16+00:00	https://arxiv.org/abs/1905.04796v1	In recent years, Industrial Control Systems (ICS) have become an appealing target for cyber attacks, having massive destructive consequences. Security metrics are therefore essential to assess their security posture. In this paper, we present a novel ICS security metric based on AND/OR graphs that represent cyber-physical dependencies among network components. Our metric is able to efficiently identify sets of critical cyber-physical components, with minimal cost for an attacker, such that if compromised, the system would enter into a non-operational state. We address this problem by efficiently transforming the input AND/OR graph-based model into a weighted logical formula that is then used to build and solve a Weighted Partial MAX-SAT problem. Our tool, META4ICS, leverages state-of-the-art techniques from the field of logical satisfiability optimisation in order to achieve efficient computation times. Our experimental results indicate that the proposed security metric can efficiently scale to networks with thousands of nodes and be computed in seconds. In addition, we present a case study where we have used our system to analyse the security posture of a realistic water transport network. We discuss our findings on the plant as well as further security applications of our metric.	arxiv	Chris Hankin, Nicolas Nicolau, Demetrios G. Eliades, Thomas Parisini
16	Learning-Assisted Secure End-to-End Network Slicing for Cyber-Physical Systems	Qiang Liu	2019-10-29T21:15:15+00:00	https://arxiv.org/abs/1910.13537v1	There is a pressing need to interconnect physical systems such as power grid and vehicles for efficient management and safe operations. Owing to the diverse features of physical systems, there is hardly a one-size-fits-all networking solution for developing cyber-physical systems. Network slicing is a promising technology that allows network operators to create multiple virtual networks on top of a shared network infrastructure. These virtual networks can be tailored to meet the requirements of different cyber-physical systems. However, it is challenging to design secure network slicing solutions that can efficiently create end-to-end network slices for diverse cyber-physical systems. In this article, we discuss the challenges and security issues of network slicing, study learning-assisted network slicing solutions, and analyze their performance under the denial-of-service attack. We also present a design and implementation of a small-scale testbed for evaluating the network slicing solutions.	arxiv	Tao Han, Nirwan Ansari
17	"A Global Analysis of Cyber Threats to the Energy Sector: ""Currents of Conflict"" from a Geopolitical Perspective"	Gustavo Sánchez	2025-09-26T12:45:29+00:00	https://arxiv.org/abs/2509.22280v1	The escalating frequency and sophistication of cyber threats increased the need for their comprehensive understanding. This paper explores the intersection of geopolitical dynamics, cyber threat intelligence analysis, and advanced detection technologies, with a focus on the energy domain. We leverage generative artificial intelligence to extract and structure information from raw cyber threat descriptions, enabling enhanced analysis. By conducting a geopolitical comparison of threat actor origins and target regions across multiple databases, we provide insights into trends within the general threat landscape. Additionally, we evaluate the effectiveness of cybersecurity tools -- with particular emphasis on learning-based techniques -- in detecting indicators of compromise for energy-targeted attacks. This analysis yields new insights, providing actionable information to researchers, policy makers, and cybersecurity professionals.	arxiv	Ghada Elbez, Veit Hagenmeyer
18	Overview of Cyber Science and Technology Programs at the U.S. Army Research Laboratory	Alexander Kott	2017-01-03T23:34:39+00:00	https://arxiv.org/abs/1702.04652v1	This paper provides an overview of research programs in cyber security performed by the U.S Army Research Laboratory. Although ARL is the U.S. Army's corporate laboratory that focuses on fundamental and early applied research, the fundamental science endeavors are closely integrated with extensive operationally-oriented programs. One example is the Cyber Collaborative Research Alliance (CRA) that brings together ARL scientists with academic researchers from dozens of U.S. universities. ARL cyber scientists are largely driven by challenges unique to the ground operations of the Army; this paper outlines a few of these challenges and the ways in which they are addressed by ARL research efforts. The long-term campaign of cyber research is guided by the vision of the future Army battlefield. In the year 2040, it will be a highly converged virtual-physical space, where cyber operations will be an integral part of the battle.	arxiv	
